{"from":"${base}","to":"${to}","counts":{"added":1,"retired":1,"raised":1,"lowered":1,"renamed":2,"deferred_ages":5,"soft_finding_ages":3},"added":[{"registry":"docs/file-size-agent-exceptions.toml","severity":"soft","path":"src/added.rs","match":"exact","rules":["rust"],"unit":"lines","value":6}],"retired":[{"registry":"docs/file-size-agent-exceptions.toml","severity":"soft","path":"src/retired.rs","match":"exact","rules":["rust"],"unit":"lines","value":6}],"raised":[{"registry":"docs/file-size-agent-exceptions.toml","severity":"soft","path":"src/raise.rs","match":"exact","rules":["rust"],"unit":"lines","old_value":6,"new_value":9}],"lowered":[{"registry":"docs/file-size-agent-exceptions.toml","severity":"soft","path":"src/lower.rs","match":"exact","rules":["rust"],"unit":"lines","old_value":10,"new_value":7}],"renamed":[{"kind":"exact-file","old":{"registry":"docs/file-size-agent-exceptions.toml","severity":"soft","path":"src/rename.rs","match":"exact","rules":["rust"],"unit":"lines"},"new":{"registry":"docs/file-size-agent-exceptions.toml","severity":"soft","path":"src/moved.rs","match":"exact","rules":["rust"],"unit":"lines"}},{"kind":"directory","old":{"registry":"docs/file-size-agent-exceptions.toml","severity":"soft","path":"tests/old_home/case.rs","match":"exact","rules":["rust"],"unit":"lines"},"new":{"registry":"docs/file-size-agent-exceptions.toml","severity":"soft","path":"tests/new_home/case.rs","match":"exact","rules":["rust"],"unit":"lines"}}],"deferred_ages":[{"registry":"docs/file-size-agent-exceptions.toml","severity":"soft","path":"src/lower.rs","match":"exact","rules":["rust"],"unit":"lines","value":7,"first_seen_commit":"${origin}","first_seen_date":"2024-01-01T00:00:00Z","age_days":10},{"registry":"docs/file-size-agent-exceptions.toml","severity":"soft","path":"src/moved.rs","match":"exact","rules":["rust"],"unit":"lines","value":6,"first_seen_commit":"${origin}","first_seen_date":"2024-01-01T00:00:00Z","age_days":10},{"registry":"docs/file-size-agent-exceptions.toml","severity":"soft","path":"src/raise.rs","match":"exact","rules":["rust"],"unit":"lines","value":9,"first_seen_commit":"${origin}","first_seen_date":"2024-01-01T00:00:00Z","age_days":10},{"registry":"docs/file-size-agent-exceptions.toml","severity":"soft","path":"tests/new_home/case.rs","match":"exact","rules":["rust"],"unit":"lines","value":6,"first_seen_commit":"${origin}","first_seen_date":"2024-01-01T00:00:00Z","age_days":10},{"registry":"docs/file-size-agent-exceptions.toml","severity":"soft","path":"src/added.rs","match":"exact","rules":["rust"],"unit":"lines","value":6,"first_seen_commit":"${movement}","first_seen_date":"2024-01-07T00:00:00Z","age_days":4}],"soft_finding_ages":[{"severity":"soft","path":"src/old_soft.rs","rule":"rust","unit":"lines","actual":5,"limit":3,"first_seen_commit":"${origin}","first_seen_date":"2024-01-01T00:00:00Z","age_days":10},{"severity":"soft","path":"src/reset.rs","rule":"rust","unit":"lines","actual":5,"limit":3,"first_seen_commit":"${movement}","first_seen_date":"2024-01-07T00:00:00Z","age_days":4},{"severity":"soft","path":"src/retired.rs","rule":"rust","unit":"lines","actual":5,"limit":3,"first_seen_commit":"${movement}","first_seen_date":"2024-01-07T00:00:00Z","age_days":4}]}
